{
  "run_id": "run-2026-03-16-769",
  "task_id": "task-2026-03-16-002",
  "status": "passed",
  "workers": [
    "dev-1"
  ],
  "created_at": "2026-03-16T01:13:41.770Z",
  "updated_at": "2026-03-16T01:13:41.904Z",
  "gate_result": {
    "task_id": "task-2026-03-16-002",
    "run_id": "run-2026-03-16-769",
    "result": "pass",
    "gates": [
      {
        "name": "cloud_ci",
        "status": "pass",
        "details": "CI passed"
      },
      {
        "name": "quality",
        "status": "pass",
        "details": "No debt increase"
      }
    ]
  }
}